{
  "jep": "1",
  "verb": "J",
  "who": "urn:audit:actor",
  "when": 1788397200,
  "what": {
    "claim": "approve",
    "n": 1e-07
  },
  "nonce": "f47ac10b-58cc-4372-a567-0e02b2c3d479",
  "aud": "urn:audit:audience",
  "ref": null,
  "sig": "eyJhbGciOiJFZDI1NTE5Iiwia2lkIjoiYXVkaXQtdGVzdC1rZXkifQ..j527tmjuPSJ-xz9-FUs-Av9mwbeqLDn8_2Y4ka59I7qpsHB3UoUuVte2HnOLfhAjwc1YHXK1P6T-ruOR7FFZDw"
}