{
  "jep": "1",
  "verb": "J",
  "who": "urn:audit:actor",
  "when": 1788397200,
  "what": {
    "claim": "approve",
    "n": 1.0
  },
  "nonce": "f47ac10b-58cc-4372-a567-0e02b2c3d479",
  "aud": "urn:audit:audience",
  "ref": null,
  "sig": "eyJhbGciOiJFZDI1NTE5Iiwia2lkIjoiYXVkaXQtdGVzdC1rZXkifQ..sW4Tdv4ekSfTzvUqCR6fJTqUHwOyCcNRoDGyjDPyiwpLWfdPH0ELXrPxgnttBDOlFzjjUokNpnJKQsJ1jQ6QBg"
}