{
  "jep": "1",
  "verb": "J",
  "who": "urn:audit:actor",
  "when": 1788397200,
  "what": {
    "claim": "approve",
    "": "bmp",
    "𐀀": "supplementary"
  },
  "nonce": "f47ac10b-58cc-4372-a567-0e02b2c3d479",
  "aud": "urn:audit:audience",
  "ref": null,
  "sig": "eyJhbGciOiJFZDI1NTE5Iiwia2lkIjoiYXVkaXQtdGVzdC1rZXkifQ..c93i96Zvosp-ZKDj2p79YS72BATEyDjIw3hHNk8sHdAE9QiG7Twv9rq34MTyFiqU3ck1hXsNnNXXjCjNqpJGAg"
}