{
  "jep": "1",
  "verb": "J",
  "who": "urn:audit:actor",
  "when": 1788397200,
  "nonce": "f47ac10b-58cc-4372-a567-0e02b2c3d479",
  "aud": "urn:audit:audience",
  "ref": null,
  "sig": "eyJhbGciOiJFZDI1NTE5Iiwia2lkIjoiYXVkaXQtdGVzdC1rZXkifQ.._9QydKV1HvAD0ylNP51a0ufpWbZFS34wBHSgTTUQk_hbAv3jZkPj-OGtid9eSP68KaLJVUgjsmycSErNcbA2CA"
}