{
  "jep": "1",
  "verb": "D",
  "who": "urn:audit:actor",
  "when": 1788397200,
  "what": {
    "claim": "delegate",
    "delegatee": "urn:audit:delegate",
    "scope": "summarize"
  },
  "nonce": "f47ac10b-58cc-4372-a567-0e02b2c3d479",
  "aud": "urn:audit:audience",
  "ref": "sha256:1111111111111111111111111111111111111111111111111111111111111111",
  "sig": "eyJhbGciOiJFZDI1NTE5Iiwia2lkIjoiYXVkaXQtdGVzdC1rZXkifQ..pg4RkUMJfF5DdLV7sC_FI9x9OMtCUDgptTu_GCw6q5rOqB4pEfcVvShTgs6D9z6ntBG65Sbf_CkMPH3sWERTCw"
}